,comment_id,comment_text,Sub1_Toxic,Sub2_Engaging,Sub3_FactClaiming
359,1739,Ich stehe diesbezüglich ausnahmsweise voll und ganz hinter Herrn Spahn. Die geplante Vorgehensweise ist die Aufforderung zur Selbstverantwortung. Und das muss ein Erwachsener der selbstbestimmt leben will tagtäglich tun.,0,0,0
360,356,"seichtes Geschwätz,...",0,0,0
361,659,"@USER Aber nicht so wie der kleine SPD Junge es ""andenkt"" mit Enteignung. Erst werden die Wohnungen an Private verkauft, dann wundert man sich das die Mieten steigen, dann will man enteignen. So kann nur ein Soze denken. Zur Enteignung gehört auch eine Entschädigung (steht so in den Gesetzen). Erst verkauft man, dann kauft (enteignet) man zu einem erhöhten Preis zurück... und das Geld fehlt dann für Neubauten ohne das sich an den wenigen Wohnungen was geändert hat. Die rendite beträgt bei den Privaten ca. 10 %, genau um diesen Betrag würde die Miete dann sinken. Ob das der Weisheit der letzte Schluß ist möchte ich bezweifeln weil es eben, mangels Geld, keinen neuen Wohnraum geben wird.",1,1,1
362,3072,"erklären sie uns doch mal im Zusammenhang mit dem Herrn Jung den von Ihnen beschriebenen ""Nazi"" ohne dabei die furchtbaren Gräulel durch Nazis im 3. Reich zu relativieren.",0,0,0
363,1465,"Ein Vulkanausbruch ergibt mehr schädlichen Dreck als alle Fahrzeuge zusammen seit Anbeginn, aber ihr lutscht halt gerne.",1,0,1
364,2859,Weshalb wollen Sie von Rechtsterrorismus ablenken? Sind Sie etwa Sympathisant?,0,0,0
365,2495,PS -ich bin eher Parteilos bzw. Veganerpartei - bevor wieder gemutmasst wird :D,0,0,0
366,1899,@USER ......aber zum zahlen schon......,0,0,0
367,3049,@USER doch ist es! @USER @USER hat sich auf die Antwort des WDR bezogen!,0,1,0
368,2176,"Lieber Staat, nehme doch mal die enorme Steuer- und Abgabenlast runter, damit den arbeitenden Menschen mehr im Portemonnaie bleibt!! Ach nee, es müssen noch Millionen mit durchgefüttert werden!!",0,1,0
369,801,@USER Schön für Dich meine Mama mag Ihm auch........,1,0,0
370,2408,"@USER die ist genauso wie die grüne Anna Lena, lässt auch keinen zu Wort kommen.Armes Deutschland 😰",1,0,0
371,182,"Heimat bedeutet, dass man dort verwurzelt ist und sich dieser gemeinschaftlichen Werten zugehörig fühlt. Selbstverständlich kann ich für mich eine andere Heimat wählen aber nur dann, wenn ich bereit bin bedingungslos diesen Idealen zu folgen! Hamad Abdel-Samad sagte einmal: wenn ich mich in einem anderen Land heimisch fühlen möchte, dann muss ich einen Teil meiner Wurzeln aufgeben! Man kann einen großen Baum auch nur dann noch in einem anderen Gebiet wieder anpflanzen, wenn wir einen großen Ballen der Wurzeln mitausgraben.....und selbst dann ist es nicht gewährleistet! Wenn ich aber nur einen Baum (erwachsener Mensch) einfach abschneide und irgendwo anders in die Erde stecke, dann wird er niemals anwachsen!",0,1,1
372,1948,"@USER Wenn Sie Sekte mit Gemeinwohldenken verwechseln, dann vielleicht! Dass mich Menschen nicht ernst nehmen, die rein materiell eingestellt sind, bin ich gewohnt. Ist nichts Neues. Daher haben wir heute aber auch die Welt, die wir haben! Diese Leute stehen sich alle selbst im Weg, die eine bessere Welt wünschen aber über Leichen gehen.",0,0,0
373,2801,@USER was machen SIE gerade in Ihrem Text - oh man 🙈🙈🙈🙈,0,0,0
374,963,@MEDIUM ihr versteht das VOLK nicht.,0,0,0
375,47,"Wenn ich immer lese ""Das muss die jüngere Generaltion"" bezahlen, dann fall ich immer lachend vom Stuhl. Ja, es können Schulden enstehen. Aber was stehen diesen Schulden denn gegenüber? Richtig! Es ensteht die EXAKT selbe Menge an Guthaben. Und dass kann man steuern. Und deswegen nennt man die Steuern auch Steuern um die Geldmenge zu stuern.",0,1,1
376,2779,@USER hat eine Ähnlichkeit mit ihnen,0,0,0
377,939,"Das wäre soooo schön, wenn ich jedem Immobilientouristen der mich 1,5 Stunden pro Termin im Objekt voll labert und nach drei Jahren immer noch nichts gekauft hat, endlich mal eine Rechnung schreiben dürfte. Und für die unzähligen Besichtigungen nach 18 Uhr und Sonntags auch mit Zuschlägen. Man hätte zwar mehr Buchhaltung zu machen bzw. mehr Rechnungen zu schreiben, aber ich glaube man würde mehr Umsatz machen!",0,1,0
378,364,Besser im Dorf zu leben als so belämmert zu reden wie diese..,1,0,0
379,113,"@USER Es geht darum, dass die Leute, die das Geld anlegen und dadurch Geld machen 25% Steuern zahlen und ich knappe 40%. Warum sollte Arbeit höher besteuert sein?",0,0,1
380,2134,@USER Armut verhindert Konsum.,0,0,0
381,2461,"7 Gäste und 1 Moderator, in 75 Minuten...was soll dabei heraus kommen ? ...ich war auch 25 Jahre in dem Job, in Ost und West, geredet wurde immer viel, nur geändert hat sich NICHTS...anständige Arbeitsbedingungen und anständige Bezahlung würde für genug Personal sorgen...wir brauchen keine Fachkräfte, sondern eine anständige Ausbildung für unsere Kinder....",0,1,0
382,2827,@USER und,0,0,0
383,1099,@USER Was hat denn Ihre AFD bist jetzt so gebracht. Hass und Hetze schaffen keine Kitaplätze... bekämpfen nicht die Altersarmut....zahlen keine fairen Löhne.... bessern keine Straßenlöcher aus....bezahlen keine Pflegekräfte...schaffen keinen bezahlbaren Wohnraum. Bisher hat die AFD zu diesen Themen noch gar Ideen vorgelegt.,0,1,1
384,2335,"Klar weil die Migranten überall anecken sich nicht benehmen. Und meist in Gruppen erscheinen und so etwas wir nicht toleriert bei uns. Ich denke das die wenigsten Menschen das Problem haben mit den Menschen an sich ein Problem,ob sie jetzt aus Afghanistan dem Irak o Libyen kommen . Das Problem ist Fallen auf durch Kleidung wie Kopftücher und das sie immer in Gruppen auftreten würden sie vielleicht vereinzelt und die Frauen ohne Verschlechterung auftreten würden sie garnicht auffallen . Ist nicht böse gemeint ist ein Gefühl",1,1,0
385,387,"...ganz falsch! Heimat ist dort, wo man seine Wurzeln hat. Selbstverständlich kann man eine neue Heimat finden, aber nur dann, wenn ich bereit bin, einen Teil meiner alten Wurzeln aufzugeben und in meiner neuen Heimat Wurzeln bilde. Wenn ich einen Baum verpflanzen, dann müssen genügend alte Wurzeln vorhanden sein und dieser Baum muss viele neue Wurzeln bilden..... sonst wie er verdorren!",0,1,1
386,505,"Ich [f]rage [m]al alle Griechen hier in der Runde:[ ][w]elches Land ist ihre Heimat? Türkei oder Deutschland?[ ]Und bitte keine Antwort [wie] ""beides"" [oder] sonst so ein Geschleime[.] Sprache ist bei der Integration enorm wichtig. Salami allerleikum.",1,0,0
387,3027,"Man kann es immer wieder sehen, die AfD ist immer für alles verantwortlich und wohl auch für die schlechten Wahlergebnisse für die Volksparteien? Die AfD gibt es nur, weil die Volksparteien mit ihre schlechten Politik dafür gesorgt haben. Wieso sind eigentlich Leute die früher in der CDU waren, jetzt in der AfD wie auch Herr Gauland????",1,0,1
388,1110,@USER und wenn die eingeladen werden kommen die nicht zu Wort weil die zu klug für die anderen dummen sind.,1,0,1
389,1280,Es gibt c. 6-7 Millionen SCHÜLER in Deutschland.Davon demonstrieren dann c. 3-4 % freitags während der normalen Schulzeit.Es gibt eine Schulpflicht und kein Streikrecht für Schüler im Gesetz! Demonstrieren können alle gerne ausserhalb der Schulzeit! Gesetze und Regeln gelten für ALLE! Ohne sie kann keine demokratische Gesellschaft vernünftig existieren.Ich selbst bin 63 Jahre und finde jugendliches Engagement gerade bei politischen Themen sehr gut. Selbst habe ich früher gegen den Vietnam Krieg usw. auch demonstriert. Der grösste Teil der Schüler beteiligt sich aus gutem Grund nicht vormittags an den Demonstrationen! Das finde ich gut. In Detmold demonstrieren Schüler waehrend ihrer Freizeit!(laut Bericht der Lippischen Landeszeitung)! Das finde ich ehrlich und überzeugend,0,1,1
390,1473,"Greta wurde von Schwarzenegger eingeladen, bin gespannt...",0,0,1
391,2041,also was kann ich für das Land tun...,0,0,0
392,2830,Es geht um die Dauerhetze bei ARD und ZDF gegen alles Oppositionelle und die Folgen für die Abschaffung der pluralistischen Demokratie und nicht um mich!,1,0,0
393,2883,"Er weiß nicht einmal, was Volksverhetzung überhaupt bedeutet. Dieser Mann ist politisch komplett ungebildet und ein völkisch-nationalistischer Agitator.",1,0,0
394,1098,"@MEDIUM Das sowieso! Frau Schröder habe ich schon sehr oft in Talkshows erleben müssen und deren Frauenbild entspricht nicht dem modernen Frauenbild unserer Zeit. Darf ich das als moderne Frau nicht kritisieren? Ich wünschte, Sie würden auf diffamierende rechte Kommentare hier auf FB genau so schnell reagieren.",0,1,0
395,2577,"@MEDIUM ARD und ZDF boykottiert seit Wochen die Opposition in allen Talkshows und systematisch in Interviews zu allen Sachfragen. Das ist empirisch nachweisbar und das wissen diese Leute auch. Grüne denen permanent die Bühne gegeben wird, sind keine Opposition!",0,0,1
396,468,"Jutta Herbst Integrationswille pffff , was denkt ihr wer ihr seid",1,0,0
397,2356,@USER Habe ich mir auch gerade gedacht. Eine Unverschämtheit so eine Ansage zu machen !,0,0,0
398,691,"ich kenne 3 köpfige Familien die haben ein Haus mit fast 300 qm2 solange diese Menschen so gefördert werden das die so unverschämt große Häuser für so weniger+ Personen bauen, solange werden diese egoistischen Menschen auch nicht auf drei der kommen mal kleiner zu bauen und dafür Grundstück abzugeben für weitere kleine Häuser. Wir haben 120 qm2 waren aber auch 5 Personen. Es muss endlich verboten werden so große Häuser zu bauen wenn es sich nicht um ein Mehrfamilienhaus handelt. Zudem gibt es viele leer stehende Häuser die so vor sich hinrotten. Die könnte man doch abreißen und diese Grundstücke für Neubauten nehmen. Aber nee, will ja keiner mehr auf dem Land leben. Lieber die Städte erweitern bis man den den Dörfern ran ist und zur Not die wälder roden und den Lebensraum der Tiere zerstören. Wir Menschen sind mittlerweile so egoistisch das uns alle anderen Lebewesen scheiß egal sind. Hauptsache ich, ich und nochmal ich. Baut doch bitte da, wo die alten Häuser vergammeln statt neue Grundstücke zu roden",0,1,1
399,1304,es sollte auch teuer kommen nur politische heiße Luft zu verbreiten..😂,1,0,0
400,2378,"Grünenwähler sind zumeist junge beeinflussbare Personen, die für betreutes Denken anfällig sind. Ohne das Hofieren der Medien und der Organisationen wären die Grünen unter 5%. Nicht die Kinder gegen von sich aus auf die Straße, sondern die vielen linken Organisationen steuern die Hysterie und die Kinder. Betreutes Denken ist normal geworden.",1,1,0
401,1619,"@USER Stimmt... man sollte sich mit dem Thema schon beschäftigen, bevor man irgendwas rausposaunt... 🤔🤷 Die Akkus sind 1. heutigen Stand, bis 75% recycelbar 2. Wie löscht man denn einen brennenden Benziner? 😱 Die Rohstoffe für die Akkus, werden größtenteils ohne Kinderarbeit abgebaut! Tesla hat z.B. einen Vertrag mit den Firmen die die Rohstoffe abbauen, das Kinderarbeit zum Vertragsbruch führt! Über den Preis kann man wohl diskutieren, aber neue Technologien Kosten zu Beginn, immer hörende Summen! Das ist der Entwicklung und Forschung geschuldet! Wobei es die neuen E-Fahrzeuge auch schon ab ca. 30.000€ gibt! 🤷",1,1,1
402,3126,"@USER einfach mal Finger nehmen und in Nase und Hinterausgang bohren statt hier auf FB rum zu Kröten,du Held. Ihr habt doch schon nichts anderes mehr im Schädel",1,0,0
403,1167,sind wir jetzt bei den Goldbergs Glubschis..,1,0,0
404,1014,Und dann verweise ich mal auf unseren Artikel 14 GG. Artikel 151 der bayrischen Verfassung finde ich da aber noch witziger.,0,1,1
405,2221,Würg. Doppelwürg.🤮🤮 Und ein Heini von der BLÖD. Also ein Dreifachwürg.,1,0,0
406,1778,"@USER🤦‍♀️ Was die Bedeutung des Wortes Widerspruch ist, können Sie im Duden nachschlagen.",0,0,1
407,2367,"DANKE für Antwort - Noch 2 Bemerkungen: Titanic-Kapitän geht nicht von Bord; Andrea Nahles bleibt - o d e r - SPD wird mit ""alten weißen Männern"" wieder wählbar ( Die jungen Grünen kann die SPD nicht überholen: Bärbock und Habeck sind unübertroffen ""geil"". (Bis heute abend. 👩‍❤️‍👩)",0,1,1
408,1340,@USER Es muß doch dramatisch klingen😂😂😂,1,0,0
409,2014,"@USER, hier die Antwort: 💙💙💙💙💙💙💙💙💙💙💙",1,0,0
410,133,""" Sie können ja gern einen Wirtschaftsflüchtling "" Wie ist deine Meinung zum Economic Partnership Agreemet?",0,0,0
411,2218,"@USER-- Wir wollen mit Künert SPD und den LINKEN eine bessere Republik aufbauen - da ist Guido REIL bei ""hard aber fair"" eine FEHLBESERTZUNG !",1,0,0
412,3037,"Ich kann mir gut vorstellen, dass die meisten Beschimpfungen und Drohungen die Leute von Arbeitsamt bekommen.",0,1,0
413,2037,Der Kühnert kennt nur das abnicken im Bundestag..,1,0,0
414,2143,"@USER Ihr Hinweis auf die AfD ist mehr als peinlich? Wo kommen ihre Zahlen denn her, von den Grünen?",1,0,0
415,2849,Neonazis haben Kontakte ins rechtsextreme Lager? Das ist mir völlig neu :-D,0,0,0
416,214,"Was bringt mit eine Nationalität oder Kultur, wenn ich zu den 16,8% der Menschen gehöre die unterhalb der Armutsgrenze leben bzw. den 1,5 Millionen Menschen, die zu den Tafeln gehen oder den vielen tausenden Obdachlosen und Armutsrentern? Was bringt einem Nationalität und Kutlur, wenn man sich nicht an der Kultur und Gesellschaft beteiligen kann aus Geldmangel?",0,0,1
417,1368,"Die Kapitalisten werden Ihnen aber dann beizeiten die Hörner stutzen... Sie glauben doch nicht etwa, dass die sich ihren Profit schmälern lassen wollen...",1,0,0
418,1204,Wir hatten die Bravo und Dr. Sommer...... das reichte voll und ganz. Diese ganze Genderdiskussion ist in meinen Augen unnütz und maßlos übertrieben. Als wenn wir sonst keine Probleme im Land haben.,0,1,0
419,840,"Ja klar, weil die Wähler der FDP ja auch bekannt dafür sind, dass sie gern günstige Wohnungen bauen, weil sie daran weniger verdienen kann. Made my day! Ratschläge der FDP zu sozialen Problem-Themen anzuhören ist wie einen notorischen Dieb zum Schutz des Geschmeides zu befragen. :D",0,0,0
420,1405,"Ob es die ""größten Umweltverschmutzer"" sind, weiß ich nicht, aber sie tragen auf jeden Fall zur Umweltverschmutzung bei.",0,0,1
421,1321,"Wow, das ist ja mal ein revolutionärer Vorschlag. Das hab ich ja erst zu meiner Schulzeit Anfang der 90er gelernt.",1,0,0
422,875,Der Landwirt wird schon enteignet wenn es um Straßenbau geht.,0,0,1
423,3094,die vielen fanatischen Hasskommentare geben Jung leider recht!!,0,0,0
424,629,@USER Belege?,0,0,0
425,2293,"@USER , in Deutschland hat jeder Gastwirt das Hausrecht und darf einzelne Personen Hausverbot erteilen. Aber wenn man Hausverbot bekommt, nur weil man eine andere politische Gesinnung hat, ist das gegen Artikel 1 unserer Verfasung. Was meinen sie, was passieren würde, wenn ein Wirt einem Muslimen Hausverbot geben würde, weil andere Muslime Terror verbreiten, Messermorde und Vergewaltigungen verüben oder Kinderehen/Vielehen betreiben.",1,1,0
426,202,Wie hat sie das Gemüse denn zubereitet?,0,0,0
427,2138,@MEDIUM die Diskussion war mal wieder für die Tonne Danke und @MODERATOR hat unsere Gebühren kassiert Pfui Teufel so ca 20tausend? UNGEFÄHR,1,0,0
428,2731,"Liegt halt irgendwie in der Natur der Deutschen, da gerne mal wegzugucken. Hat sich seit 1933 nicht viel getan.",0,0,0
429,2314,Reil hat VIEL zu viel Redezeit! Wat soll das?,0,0,0
430,2135,@USER eine Frau mit wirtschaftlicher und sozialer Kompetenz. Reicht das nicht?,1,0,0
431,1643,@USER: und wieder ein Kommentar ohne Fakten..,0,0,0
432,757,Hättet die nicht verkauft wäre es besser gewesen,0,0,1
433,1515,dass ich dem poschardt mal ein like gebe.... aber er hat recht.,0,1,0
434,734,"Absolut richtig. Jahrzehnte haben die mietervereine darauf hingewiesen dass von Jahr zu Jahr mehr Wohnungen fehlen, dazu noch die verheerenden Entscheidungen bei der Flüchtlingspolitik, bei der Energiepolitik und bei der Geldpolitik und jetzt wird die Verantwortung für die eigenen Fehler auf die bösen Immobilieneigentümer abgeschoben.",0,1,1
435,965,@USER Wien ist allgemein teurer als Berlin.,0,0,1
436,754,"@USER , mir kommt es aber so vor als würde der Profit in hohem Maße im Vordergrund stehen.",0,0,0
437,1157,"im Zeitalter der bevorstehenden Digitalisierung in allen Ebenen welche noch vor uns liegt, da wird es bald heißen Druck von KI oder durch KI..",0,0,0
438,3025,Wie viele Nazis haben sich nach dem Krieg im Westen versteckt oder sind untergetaucht - sie waren sogar in der Justiz und im damaligen Bundestag nach dem Krieg vertreten - Immer sind andere an allem schuld.,0,0,1
439,201,Da ist was dran,0,0,0
440,3057,"Warum muss man sich eigentlich immer gegenseitig beleidigen? Man kann auch respektvoll miteinander diskutieren - das ist gar nicht so schwer , nur Mut! 😉",0,1,1
441,195,Ob das die Menschen ohne Staatsangehörigkeit auch so sehen?,0,1,0
442,2424,@MEDIUM wir sind halt kreativ. 😁,0,0,0
443,2511,"Will man etwas verändern, sollte man sich bewegen!",0,0,0
444,1890,"hier mal bissel lesestoff, was so getrieben wurde.... blut in urin mischen lassen, um in der warteliste nach oben zu gehen.... und andere kleinigkeiten beim nach unter scrollen, wo weitere artikel zu finden sind: https://www.sueddeutsche.de/muenchen/organspende-skandal-transplantations-arzt-laesst-aemter-ruhen-1.1699296",0,1,1
445,555,"Es sollte aber Medienschaffenden durchaus bewusst sein auf welcher Klaviatur sie dort spielen. Die Kommentare hier sind ja auch entsprechend. Seit einigen Jahren spricht man von Rissen, und Spaltung.... Hallo? Homogene Volksgemeinschaft ist das Gegenstück dazu. Unterschiedliche Haltungen und Menschenbilder... das ist unsere Gesellschaft. Und da knüpft diese Fragestellung nach ""Heimat"" nahtlos an den rechten Diskurs an.",0,0,1
446,2494,Kein Interessenkonflikt? Ist Habeck deshalb so siegessicher weil er sich jetzt danach mit Vize-Kanzler nicht begnügen muss...sozusagen eine Hand wäscht die Andere? Dann dürfen Sie (Grüne) aber auch nie wieder gegen die AfD wettern! Sie verhindern ja selber dass die Wahrheit ans Licht kommt.,1,1,0
447,26,""" 675 Milliarden!"" Das ist dein Denkfehler. Auf was für Einnamen kann denn der Staat Deutschland zurück greifen?",0,0,1
448,384,Christel Friedrich Was seit Ihr für Deutsche die sich mit einer Frau an den Tisch setzen die hier alles schlecht macht,1,0,0
449,186,"@USER naja, wenn man bedenkt wie teuer diese Stadt durch die Bauern geworden ist würde ich sagen, dass das nicht mehr so ganz stimmt. Außerdem hat Süddeutschland sehr, sehr lange durch den LFA mehr als profitieren können und die heutigen Wohlstandsstrukturen erst aufbauen können. Kein Bundesland hat mehr durch Subventionen profitiert als Bayern, gefolgt von NRW. Also bleibt schön mit Euren Ärschen dahoam 😊",1,1,1
450,1128,"@USER habe keine Frage gestellt, war eine Feststellung🤣",0,0,1
451,1777,@USER Aber dann bitte auch selber kein Organ annehmen wenn es mal nötig werden sollte.,0,0,0
452,211,also ich verstehe ihn sehr gut.. host mi..,0,0,0
453,3111,"Das kann man ,so leid es mir tut, nicht vergleichen. Wie man bei der in der Talkrunde gezeigten Statistik sehen konnte, handelt es sich bei linkem Extremismus in der Regel um Sachbeschädigung, Widerstand gegen Polizisten usw. Rechter Extremismus äußert sich mit Bedrohungen, in Gewalt gegen Personen bis hin zu Mord. Mit seiner Hetze die man überall nachlesen kann, ist Herr Junge auch ein Täter - ein Brandstifter. Wohin diese verbalen Entgleisungen führen, hat man jetzt an Herrn Lübke, Frau Reker usw... gesehen.",0,1,1
454,2396,"@USER, leider sind Manche bei uns in München immer noch nicht wirklich in Bayern angekommen. Leider!",0,0,0
455,713,"@USER nö, einfach nur so krass. Aber danke Sie Rechenkünstler",1,0,0
456,614,"@USER Die AFD war ja wohl extrem oft zu Gast. Diese Verschwörungstheorien kann doch keiner ernst nehmen, sorry. Immer dieses ""Die AFD ist das arme Opfer"" Dieses Geheule regt mich extrem auf",0,0,1
457,1168,na da werden die Väter jetzt schauen und sagen zu den Müttern pack de zaum und flieg zum Mond da bekomm ich Geld..,0,0,0
458,2186,Das Volk wird und wird nur ausgebeutet.,0,0,0
459,2908,"Entblättern Sie sich ruhig weiter mit Ihrem demokratie- und menschenrechtsfeindlichen Auftritt hier. Es darf ruhig ein Jeder lesen, welch Sympathisanten die völkisch-nationalistische AfD anzieht.",0,0,0
460,2452,"27.03.2019 in Hamburg, im Hopital zum Heiligen Geist war der SPD-Bürgermeister Tschenscher, Nachfolger des SPD-Bürgermeisters Olaf Scholz (derzeit Bundesfinanzminister) zu Gast. Er sagte: ""Es ist die letzten 20 Jahre etwas schiefgelaufen."" Hallo?! - Die letzten 20 Jahre regierte die SPD in Hamburg fast ausnahmslos. Die letzten 20 Jahre regierte die SPD im Bund fast ausnahmslos mit. Und wen lädt das öffentlich-zwangsfinanzierte Fernsehen als Vertreter verantwortlicher Gestalter politischer Rahmenbedingungen ein? Wer darf sich wieder mal präsentieren?! - Jetzt halt als Darsteller in der Rolle: Wir haben verstanden und tun was. - Der Bürger hat ein Recht darauf ... - Na? - Wer wohl?",1,1,1
461,112,@USER Nur ist der Steuersatz ganz anders. 25% sind weniger als knapp 40%. Das Steuersystem ist ungerecht.,0,1,1
462,359,die ist wie ein MG....taktaktaktaktaktak...,0,0,0
463,2598,"@USER Nee, ich habe Angst vor Menschen wie Ihnen, die glauben, dass man ""Klimaneutralität"" damit zusammenfassen kann, dass man ""einmal die Woche vegetarisch isst"". Leute, die glauben, dass man SUV ""kaputtbesteuern"" muss, ohne auch nur im Ansatz zu erkennen, was damit wirtschaftlich alles zusammenhängt und wie man sich damit eben der Mittel beraubt, die unabdingbar notwendig sind, wenn man so schwachsinnige Forderungen wie ""Garantiesicherung"" stellt. Wieso fordern Sie nicht, dass man alte VW Busse von der Straße entfernt? Oder all die alten VOLVO-Panzer Ihrer Parteigenossen? Wenn Sie irgendwann über Klimaschäden faseln, dann sind sie da besser aufgehoben. Leute wie Sie sind es, vor denen ich Angst habe. Weil sie einfältig sind, weil sie studiert haben und glauben sie wären deswegen irgendwie schlauer als andere. Aber das lernen Sie und ihre kleine Familie auch noch. The Hard Way. Einfach weiter die Grünen wählen.",1,0,0
464,1057,@USER ja @USER! Reicht das als seriöse Quelle? Das ist der Oberbürgermeister von Tübingen!,0,1,1
465,1207,Der Hank geht mir dermaßen auf die Eier.,1,0,0
466,2071,"Liebes @MEDIUM-Team... wie wäre es bei solchen Themen denn mal.., einfach nur normale Bürger, mit Erfahrungen aus dem wirklichen normalen Leben einzuladen?? Nicht immer die gleiche ""hohen Personen"" aus Wirtschaft und Politik, die nicht mit vorbereiteten psychologisch ausgearbeiteten und vorbereiteten antworten und Ideen daherkommen..! Einfach mal die wirklichen arbeitetenden Menschen zu Wort kommen lassen! Denn meine klare Meinung ist.. wer nicht den normalen, stressigen und immer schwerer werdenden Alltag im ganz normalem leben kennt..der kann mir auch nichts erzählen und schon garnicht helfen!!",0,1,0
467,520,@USER ...sprach die AfD Schule des Lebens Abgängerin! 🤦‍♀️,1,0,0
468,2907,"Er ist ein völkischer Nationalist mit stramm antidemokratischer Ausrichtung, @USER.",0,0,0
469,1990,"@USER Sie sagen es, @USER. Ausgangslage sind zu wenig Organspender, obwohl mehr als 80% der Deutschen angeblich dafür sind, sich aber aus irgendwelchen Gründen den Ausweis nicht holen. Wie wäre es denn mit einer weniger die Grundrechte aller einschneidenden Lösung? Jeder Bürger wird dreimal informiert und ein Organspendeausweis beigelegt, plus der Möglichkeit, sich unkompliziert und online als Spender zu registrieren? Wegen mir auch alle 5 Jahre. Wer sich dann immer noch nicht registriert, der will offenbar nicht. Gleichzeitig haben grundsätzlich spendenwillige Menschen wie ich, die aber auf Grund entsprechender Skandale in der Vergangenheit dem System misstrauen, immer noch die Möglichkeit, den Willen den Angehörigen mitzuteilen, damit diese dann das OK geben können. Aber man trägt das „Spenderschild“ eben nicht offen mit sich rum. Der Gesundheitsminister hat in meinen Augen einfach die Pflicht, eine Variante zu wählen, die dem Prinzip der Verhältnismäßigkeit mehr entspricht. Die Politik macht gerade nichts anderes, als die Gesellschaft zu spalten, und das finde ich traurig.",0,1,1
470,725,"...ja wenn die Barley kommt, wird bestimmt alles gut...😂😄🙈",1,0,0
471,2405,"Die gute, alte CSU ist Deutschlands, ähm... Bayerns, letzte stabile Volkspartei. Weiter so! 👍 München mal außen vor gelassen.",0,1,0
472,1530,"Der Regenwald wird im Akkord abgeholzt ,das interessiert niemanden !",0,0,1
473,3237,Deutschland und Brüssel braucht einen Salvini und Orban in Deutschland und Brüssel,0,0,0
474,3078,"„Wir bemühen uns, AfD-Vertretern kein Forum für ihre Zwecke zu bieten. Je nach Thema ist es aber von Fall zu Fall nötig, AfD-Politiker selbst zu Wort kommen zu lassen.“",0,1,1
475,1971,"Dieser Mann sollte Minister sein, da er was vom Fach VERSTEHT.",0,1,0
476,435,Deutschland ist nicht mehr lebenswerter für uns ka punkt punkt punkt ken ! Es wird zeit das wir alle unser koffer packen und die daitschen mit ihrem aus Rumänien neu eingewanderten roma/sinti migranten alleine lassen . Punkt aus ende der Diskussion,1,0,1
477,2303,Ich liebe das Gejammer aus der Faschoecke. Keine Argumente die auch nur ansatzweise zu einer Diskussion führen könnten aber im Schneckenhaus der Toleranz die ersten.😊,0,0,0
478,1760,"also wenn man KEINEN ausweis hat, egal warum, vielleicht war man einfach nicht schnell genug oder wenn kein ausweis gefunden wird, ist man automatisch spender. richtig finde ICH das nicht. eigentlich gehören meine organe automatisch MIR und das auch nach meinem tod",1,1,0
