,comment_id,comment_text,Sub1_Toxic,Sub2_Engaging,Sub3_FactClaiming
479,2944,@USER Sie haben auf Ihrer Seite wortwörtlich gepostet - die AfD ist Mittäter - das würde ich so nicht tun - das müssen sie selbst verantworten was Sie da veröffentlichen - ich würde dsas so nicht tun denn Sie sind nicht die Polizei - die hat das Recht dazu nicht Sie. Wie ich bei Ihnen gelesen habe sind Sie Liebhaber der Antifa - da ist ja alles klar so unbescholten ist die auch nicht oder irre ich was man so hört?,1,1,1
480,647,@USER Ich bin schon längst in der Partei DIE LINKE aktiv und versuche auch hier in meinem Landkreis eine Aufstehen-Gruppe ins Leben zu rufen. Doch hier in diesem schwarzen Landkreis ist dass eine verdammt schwere Aufgabe. Ich hoffe dass wir durch unser neues Parteibüro jetzt einen Fuß in der Tür haben und dieses als Ausgangsbasis nutzen zu können.,0,0,0
481,1412,@USER China und Indien haben zusammen über 3000 kohlekraftwerke. Über 300 befinden sich im Bau. In Afrika wird auch angefangen Kohle zu verheizen. Ich glaube kaum das die damit aufhören. Und solange fahre ich meinen Euro 3 Diesel.,0,1,1
482,1920,"@USER Da bin ich mir noch nicht so sicher. Ich hoffe, die Auferstehung ist auch nur mit dem Geist möglich. Der Körper ist an sich nur eine Projektion des Geistes. Man wird wohl erst schlauer sein, wenn es so weit ist.",0,1,1
483,343,Und für mich sind Sie a u c h eine Deutsche :-),0,0,0
484,1418,"@USER , selber asoziales Geschwätz. Deine Ignoranz schafft den Planeten!",1,0,0
485,1823,"@USER niemand bestimmt über meinen Kopf ,aus Protest schon nicht .",0,0,0
486,1815,"Interessant, diese Aussage..... das Herz schlägt nur, weil eine Herz-Lungenmaschine den Kreislauf stabil hält. Schaltet man diese Maschine ab, bleibt auch die menschliche Pumpe stehen. Ich verstehe diese Aussage nicht...... es scheint mal wieder das richtige Fachpersonal dort zu sitzen.",0,0,1
487,261,@MEDIUM beste Beispiel ist DSDS. Wieviel Deutsche machen da mit? Augen aufmachen schadet nie. Lg,0,1,1
488,2254,"naj, scheint spannend zu werden. Da hat @MEDIUM ein brisantes Publikum eingeladen.",0,1,0
489,562,"@MEDIUM Ich schrieb nicht, dass ihr Propaganda betreibt. Herr @MODERATOR hat den Grund für den shitstorm, den @MEDIUM geerntet hat, nicht verstanden. Viele Kommentatoren tun übrigens genau das, was ich eingangs kritisiere: sie sprechen mir MEINE Heimat Deutschland ab, weil mein Vater Türke ist und das ist eben auch dem meines Erachtens nach unglücklich gewählten Titel geschuldet. Hier nachzulesen: https://www.facebook.com/@MEDIUM/posts/1973722566059879?comment_id=1974343242664478",0,1,1
490,404,"@USER Ich bin Deutsche, liebe jedoch Europa in seiner Vielfalt.",0,0,0
491,421,"⚠ #FAKTENCHECK ! ⚠ solch' eine ""Person"" läd die ARD in ihre Sendung ein ! ⚠ #STRAFTATBESTAND der #VOLKSVERHETZUNG gemäß Paragraph 130 StGB ! ⚠ hier die #FAKTEN ! ⚠ 🔻🔻🔻🔻🔻🔻🔻🔻🔻🔻🔻 https://m.facebook.com/story.php?story_fbid=161302631486809&id=100028212202868",1,1,1
492,1518,"Stolypin returns, pfui deibel.",0,0,0
493,2193,@USER mit freundlicher Unterstützung und Genehmigung der örtlichen Liberalen und Konservativen und eines damaligen Beschluss der gleichnamigen Bundesregierung für eine Marktorientierte Lösung. Ich bitte dies bei den nächsten einseitigen Behauptungen zu berücksichtigen und zu ergänzen!,0,0,1
494,2682,@USER bitte sagen Sie mir was Ihre Moral dazu sagt das Grüne zusammen mit CDU gegen die SPD die NSU-Akten 120Jahre unter den Tisch fallen lassen?!,0,0,1
495,1900,@USER sie sind als Spender eh schon zu alt.....sorry,1,0,1
496,2354,Vergleicht mal die Wahlergebnisse von West- und Ostdeutschland!,0,0,0
497,653,"Ich kann dieses unerträgliche Staatsbashing, der ja alles versäumt und verbockt hat nicht mehr hören. Die Miesere zu verantworten haben die, die den Hals nicht voll genug bekommen können. Die Gierigen und Abgreifer, die Mieter wie Renditevieh betrachten. Das ist vor Allem ein moralisches Problem und so lange wir Raffgier für eine erstrebenswerte Tugend halten wird sich daran nichts ändern.",0,1,1
498,2497,"übrigens sind 54,1% gegen die Asylpolitik - ich muss dann immer lachen, wenn ich ""wir sind mehr"" Schilder sehe :D",0,0,1
499,1449,Greta sagt ja zu AKWs..,0,0,1
500,820,Stimmt weil Vonovia und co ja kleine Arme Leute waren die mit eigener Hände Arbeit Stein auf Stein ihr Menschenunwürdiges Monopol errichtet haben. Ach nein stimmt haben sie ja gar nicht.,0,0,1
501,496,"@USER Nee, Du verstehst nicht, dass es etwas aussagt, wenn man von jemandem mit fremdem Namen Dankbarkeit fordert, von allen anderen aber nicht. Du bist garantiert nicht ""deutscher"" als ich. Meine Freude darüber, in Deutschland zu leben, habe ich geäussert. Warum fragst Du nicht die anderen Kommentierenden danach, ob sie dankbar sind, hier zu sein? Zum Beispiel den @USER? Weil es um meine Gene geht und nicht darum, WER ich bin. Hatten WIR schon in UNSERER Heimat, war scheisse, ist scheisse und wird es immer sein.",0,1,1
502,2524,"Wir leben in einer globalen Welt ! Wir haben nur diesen einen Planeten ,und wir können nur gemeinsam etwas bewirken, egal was Trump,45. Präsident,gerade tut,...?!",0,0,1
503,2534,@MEDIUM Ich bin gespannt.,0,0,0
504,2805,Sehr bedenklich,0,0,0
505,2423,@USER ich habe so einen guten Optiker. Vielleicht lasse ich die Brille dann weg.,0,0,0
506,928,Dann müssten aber auch die Versicherungen die Prämien für abgeschlossene Verträge bezahlen... nicht nur bei Immobilien... aber ob da nur eine Wohnung gebaut wird weil die Makler Gebühren billiger werden kann ich mir nicht vorstellen... Grunderwerb Steuer abschaffen wäre eine Möglichkeit... aber Frau Barley arbeitet nach dem St Florians Prinzip...,0,1,1
507,1141,Na und? Kannst alles besser machen.,0,0,0
508,128,""" Dann sind Sie also dafür, dass diese Menschen vom einen Elend ins nächste gelangen und irgendwann so verzweifelt sind, dass sie entweder drogensüchtig oder kriminell werden, schlimmstenfalls auch aus Frust gewalttätig?"" Na Problem erkannt?",0,0,0
509,1294,"Habe ich das richtig verstanden, dass er behauptet VW hätte nicht betrogen? VW hat einen Betrug begangen der im Bereich organisierter Kriminalität liegt. Soviel zur Wahrheit und zur Übernahme von Verantwortung.",0,0,1
510,1568,Die naive Luisa sollte anstatt zu demonstrieren Ingenieurin werden und mit ihren Erfindungen dann wirklich was verbessern,1,0,0
511,2068,@USER auweia. Diese Pillen möchte ich auch haben. Schon mal Bio Schweine gesehen in Mecklenburg ????? Ich merke schon es ist Hopfen und Malz verloren ! Und noch eines ich habe diese berichte gesehen. Nix von hören und sagen . Was ist mit den anderen Argumenten die ich hatte ?,1,0,0
512,1991,"@MEDIUM leider nicht 😉aber gut zu wissen. Dann bleibt nur zu hoffen, dass in so einer wichtigen Sache die Partei- bzw. Fraktionsgrenzen keine Rolle spielen. Im Interesse aller und besonders im Interesse, derer, die auf Organe angewiesen sind 👍🏻",0,0,0
513,1923,https://www.welt.de/vermischtes/article4681605/Festnahmen-bei-Schlag-gegen-Organ-Mafia.html?fbclid=IwAR1OOmS4k_xyRPH80IyuhFXacux3Qz5dAnIpKrbK6rTjKXRkPZ08CcPhfg8,0,1,1
514,2568,Boykottiert die Zwangsgebühren!!!,0,0,0
515,1916,"Alles, alles Gute weiterhin 😉👍 Ein echter Lichtblick in Sachen sympathischer/m Ausstrahlung/Auftreten in der Sendung 😊",0,1,0
516,891,@USER: Woher kommen denn noch 1 Mio. Migranten? Hast du alternative Fakten inhaliert?,1,0,0
517,1954,"@USER Nun, da haben Sie Glück, dass Sie nicht hirntot waren, sonst hätte man sie wohl ausgenommen bei lebendigem Leib und Sie wären nie wieder aufgewacht! So wie derjenige, von dem Sie die Lunge haben.",0,1,0
518,307,Nicht dieses Knäckbrot KGE NO PLEASE ich bekomme einen Pickel...DOLL,1,0,0
519,2328,@USER das trifft leider auch auf erschreckend viele Deutsche zu. ..🙄,0,0,0
520,2255,"Geht alle wählen !!!!!! Damit die Altparteien unter 5% kommen. Es gibt außer SchwarzRotRotGrün noch 36 andere Parteien ! Wählt die , damit die Altparteien abgewählt werden !!!",1,1,1
521,1329,Herr Lang ist halt nicht besonders intelligent.,1,0,0
522,2552,"@USER Ja, die Grünen haben das Perpetuum Mobile erfunden.Sich selbst erschaffende Energie.",0,0,1
523,291,"@USER Ihre rechtsextreme AfD Meinung. Ihre Blut und Bodenideologie können Sie für sich behalten. Zum Glück gibt es viele Millionen fortschrittlich denkende Menschen und nur eine Minderheit Ewiggestriger wie Sie @USER. Warum überrascht es mich nicht, daß Sie als Dresdnerin und Sächsin so denken? Übrigens habe ich in Sachsen eine Reihe von Familienangehörigen, Freunden und Bekannten die die braunblaue Denke ablehnen und für unsere Demokratie, für unsere Art zu leben und gegen Antidemokraten auf die Strassen gehen.",1,0,0
524,3208,@USER Warum lassen sich die Bürger das gefallen und warum sind die Menschen so naiv solche Parteien wie die CDU oder SPD zu wählen.? Die haben doch alle versagt im gewissen Sinne.,0,0,0
525,198,"Und leider ist man selbst so einer, den man im Urlaub nicht treffen will an all den exotischen überlaufenen Orten :-)",0,0,0
526,2015,💪💙💪💙💪💙💪💙💪💙💪 1. Grenzen wirksam sichern 2. Islamisten und Sozialschmarotzer des Landes verweisen 3. Abgelehnte Asylanten umgehend abschieben 4. Innere Sicherheit wieder herstellen 5. Wehrpflicht wieder einführen 6. NGOs das Handwerk legen 7. Den Kampf gegen das Automobil beenden 8. Radikale Moscheen schließen 9. GEZ abschaffen 10. Die EU und den Euro verlassen 11. Sanktionen gegen Russland aufheben 💙💪💙💪💙💪💙💪💙💪💙💪,1,0,0
527,1587,@USER Sie disqualifizieren sich selbst!,0,0,0
528,1812,"dieses leben retten habe ich erlebt bei meinem nachbarn, der vor lauter vergnügen am postoperativen leben verschieden ist, elendig. denn auch die 2. ersatzniere hat nicht gearbeitet. 3 jahre lang mit spende nur schmerzen, täglich !! zur dialyse.... diesen wahnsinnspömpel in der armbeuge. dieses traurige gesicht. eigentlich ist mir dadurch die sinnhaftigkeit dieses herangehens zum rätsel geworden.",0,1,0
529,1488,"@USER Pippi hatte ja immer einen Affen dabei, nun zur Zeit machen sich Medien und Politik sehr zu solchen..",1,0,0
530,1060,Stärkt endlich die Unter- und Mittelzentren. Nicht jeder Mensch muss in einer Großstadt wohnen. Erstrebenswert ist es sowieso nicht.,0,0,0
531,698,Wo wohnen die 2 Mio Neuen eigentlich so und wer bezahlt das sogar noch ? 🤦‍♀️⛔️🤬,0,0,1
532,573,"@USER Aus gutem Grund ist die AfDerpartei um Faschist Landolf Ladig, aka Bernd Höcke abzulehnen.",0,0,0
533,1752,"Ich finde nicht, dass das ein Eingriff in die Selbstbestimmung ist. Im Gegenteil! Es zwingt einen dazu über sich selbst zu bestimmen wenn man keine Organe will. Also selbstbestimmter geht es fast schon nicht mehr.",0,1,0
534,746,"Wir brauchen dies, wir müssen das, wir wollen dieses, wir werden jenes,..... Nur Gelaber um den heißen Brei.",0,0,0
535,2658,Wenn ich mir die Wähler so anhöre die sagen sie gehen nach aussehen oder wie sympathisch Ihnen ein Politiker ist dann frage ich mich schon sind die noch ganz sauber diese Wähler,1,0,0
536,2332,"Ach so, ich trage auch keine Jeans, da bin ich sicher schon in den 80ern indoktriniert worden ...VOM ISLAM. 😂",0,0,0
537,1416,@USER: Und was hat das mit dem Thema zu tun?,0,0,0
538,1392,Argumentative Mängel? War erwaren sie denn? Das sind Schüler. Sie erkennen ein Problem aber sie können nicht erwarten das sie dieses auch vollumfänglich Analysieren und Lösungen Parat haben. Aber dieser Mangel ändert nichts daran das diese Kinder ein Problem erkannt und die Initiative Ergriffen haben.,0,1,1
539,804,@MEDIUM Sie sind doch nicht ernsthaft der Ansicht das es keinen AfD Politiker gibt der sich da nicht auskennt? Es gibt sogar eine Seite der AfD die dieses Thema aufgreift. https://afdkompakt.de/tag/mieten/. Schade das auch @MEDIUM sich dem Mainstream unterordnet und die Wut der GEZ Zahler steigert. So schadet man der Demokratie in diesem Staat.,0,1,1
540,3243,@USER .Die warten da,0,0,0
541,2190,@USER er residiert in einem Palast aber hat immer und überall versagt? 🤔 Ja nee is klar 🤦‍♂️ Das Braune um deinem Mund herum ist keine Schokolade. Nur damit du bescheid weißt! 🤫,1,0,0
542,2253,"Och zeigt doch noch mal das Bild, was die AfD unrechtmäßig verwendet. Da gibt es ne einstweilige Verfügung von dem Haus wo dieses Bild hängt... macht noch mal...",0,0,1
543,2243,Hach Familie Ritter auch am Start... War klar... //Team Boris Palmer Watch,1,0,0
544,572,"@USER Meistens verläuft das Gespräch so: Woher kommst Du? - aus Hannover Nee, ich meine ""WOHER"" kommst Du? - äh...Hannover Und wo bist Du geboren? - In Hannover Aber heisst Du nicht ""Cem"", wie der Özdemir? - Ja, der kommt auch aus Deutschland. Ist das nicht ein türkischer Name? - Doch, schon, ja. Na dann kommst Du ja doch aus der Türkei und nicht aus Hannover (freu) ... so kann es noch minutenlang weitergehen, und es nervt gewaltig, ist langweilig und als erste Frage übergriffig und nicht grade sehr helle, um nicht zu sagen hirnverbrannt dumm und nicht motivierend, das Gespräch weiterzuführen. Mit jammern hat das ganze rein gar nichts zu tun.",1,1,0
545,2026,"Blackrock, Cerberus,..",0,0,0
546,107,"Die Reichen werden immer reicher und die Armen immer ärmer. Der Mittelstand schrumpft und knapp 1/3 bis die Hälfte der Bevölkerung ist von Altersarmut betroffen. Die Umverteilung des Geldes ist ein Weg, der unumgänglich ist. Es geht nicht darum Leuten den ganzen Reichtum wegzunehmen, sondern lediglich darum Probleme zu lösen und das Geld muss irgendwo herkommen. Die Reichen und Superreichen werden es überleben, dass sie etwas mehr Steuern für das Gemeinwohl zahlen müssen. Hier wird ja bewusst so getan, als wäre das der Weltuntergang. Hier stellen sich viele auf die Seiten der Reichen und Superreichen. Wie kann man denn so bescheuert sein?",1,1,1
547,483,*shitstorm incoming,0,0,0
548,3038,"Die größte Gewalttat, die nicht diskutiert wird, ist die Bekämpfung des Pluralismus durch ARD und ZDF... Und se lassen es sich auch noch bezahlen und wollen immer mehr!",1,0,0
549,944,Dürfen in dem Land ihr eigentlich nur noch Politiker Geld verdienen und alle anderen müssen am Existenzminimum knabbern oder was läuft hier für ein Film?,0,0,0
550,3183,"@USER das mag sein, und kann es auch aber europaweit wachsen die rechten Gruppierungen und das ist auch Tatsache und ich wusste nicht, das Franzosen Ostler sind und ob sie es glauben oder nicht do manch Ostler hat auch ohne Kredite mehr vom Westen gehabt und vom Ausland als so mancher Wessi",0,0,0
551,1886,Lohnt sich die Wiederholung anzusehen? Frage für einen Feind.,1,0,0
552,3128,Demokratisch gewählte Partei..demokratisches Recht auf Meinungsäusserung..Hast wohl ein Problem damit?,1,0,0
553,215,@USER Mal eine kleine Frage. Ging es dir vor den Flüchtlingen besser oder schlechter?,0,0,0
554,751,"Hier in diesem Vortrag wird der Umverteilungmechanismus über den Produktionsf. ""Boden"" erklärt. Ab Minute 33:00 wird an einem Beispiel das ""Henry George Theorem"" mit dem Resultat des höheren Einkommens dargestellt. @MEDIUM, wieso ladet ihr eigentlich nicht mal Experten zu diesem Thema wie Professor Dirk Löhr in die Sendung ein? https://www.youtube.com/watch?v=TMOStc_Zys4",0,1,1
555,2999,"Journalismus hat nicht neutral zu sein. Das ist kein Leitmotiv journalistischer Arbeit und wird auch nirgendwo in der journalistischen Ausbildung so gelehrt. Außerdem handelt es sich nicht um eine Nachrichtensendung, sondern um eine Talkshow.",0,0,1
556,2897,"@MEDIUM, Sie nutzen gerade dasselbe Strohmann-Argument wie die AfD selbst, indem Sie von ""demokratisch gewählten Parteien"" erzählen. Es gibt hierzulande keine undemokratisch gewählte Parteien, und die AfD ist eine völkisch-nationalistische Partei und somit antidemokratisch.",0,1,1
557,1613,@USER China ist ja auch in Sachen CO2 Ausstoß ganz weit vorrausichtlich ihr Öko sp.....,1,0,1
558,238,"@USER, es ist seit Jahrzehnten bekannt, dass Ausländer sehr viel schnelle inhaftiert werden, weil sie einen höheren Fluchtanreiz haben. Das ist nicht neu - außer dir vielleicht.",1,1,1
559,1510,"Es war halt viel blabla, wie ich es mir gedacht habe. Wir können in Deutschland uns abstrampeln soviel wir wollen, denn Deutschland rettet das Klima nicht allein. Aber das ist typisch deutsch: alle(s) retten wollen. Aber gut, dass man darüber geredet hat.",0,1,1
560,2661,Unterstellungen? Erst wenn Hessens-Grüne die NSU-Akten frei geben und nicht 120Jahre verschwinden lassen-sie blockieren gegen die SPD aber Hand in Hand mit CDU! Ein Schelm wer böses dabei denkt...,1,0,1
561,2087,@USER das wird nie passieren dazu gibt es zu viele die noch weniger haben und deshalb ist doch das mit dem Zuzug so gewollt,0,1,1
562,2042,verd. jetzt muß ich wegen der runde meine Tabletten früher einwerfen..,0,0,0
563,244,Träum weiter,1,0,0
564,1826,@USER ist ja schlimmer hier als damals in der DDR,0,0,0
565,3044,"@USER heute ist's aber besonders schwer mit der Rechtschreibung. Musst mal deutsch lernen, Mädel oder was auch immer.",0,0,0
566,2668,@USER .Das waren ja Vögel am Flughafen,0,0,0
567,1546,@MEDIUM - Warum verteidigen Sie so vehement den Flug von Lanz?,0,0,0
568,369,Die hat zwei drittel Redezeit sie ist angekommen..,0,1,1
569,1039,@USER der tolle Kapitalismus bringt einem zum enteignen. Im Übrigen ist es legal jemanden zu enteignen wenn dieser horrende Summen einfordert.,0,0,1
570,2125,"@USER? Also wir tun uns glaub schwer.. 😅 Ich weiß wieder nicht, worauf du hinaus willst?",0,0,0
571,94,"@USER, sorry, da muss ich sie enttäuschen...... Bitte schauen sie sich mal die vielen Folgen ""Der Anstalt"" zu diesem Thema an! Falls sie sich diese Mühe machen möchten, würde ich gern mit ihnen diskutieren....Danke!",0,1,0
572,2393,"Geehrtes @MEDIUM Team. Zunächst zu der Frage: ja 75 Minuten hätte ich mir zugetraut. Nun zu meiner Aussage: Genau an so einem Tisch stelle ich mir einen Leihen vor, der seine Wahlbeteiligung und dessen Gründe erläutern kann. Dadurch würde die Runde authentischer und, so zumindest meine Einschätzung, volksnäher. Ich verfolge ihre Sendung sehr gerne und auch nächste Woche wieder. Es ist leider immer wieder schade zu sehen, dass genau an der Stelle, wo das Thema richtig groß ist, der Normalbürger nur im Hintergrund ist. Sie haben mit Sicherheit alle Kommentare der Sendung gelesen und hoffentlich auch gesehen, dass die Mehrheit der Meinungen sehr einfach sind und die Gäste der Sendung dies aber nur spekulativ diskutieren.",0,1,0
573,2745,"@USER 1. was hat die afd damit zu tun? 2. Der Staat und die Medien gehen gegen jeden vor der eine andere Meinung hat als sie! Jeder ist ein ""Nazi"" 3.haben Sie sich überhaupt schon mal mit Polizisten unterhalten?! 4. Manche Eltern, der Staat und die Presse unterstützen Schule schwänzen! Die Schulpflicht wird bei Seite geschoben! Es wird suggeriert, dass Gesetze nicht beachtet werden müssen.",0,0,0
574,1512,"Gerade hat China wieder 300 Airbusse in Frankreich bestellt. Die scheissen auf den Klimawandel, obwohl ein Umdenken dort stattfindet.",0,0,1
575,2595,"Also, wenn ich eine Pulle Bier kaufe, die vorher im Supermarkt 0,85 Euro (ohne Pfand) gekostet hat und für die ich nun 0,95 Euro (ohne Pfand) dann ist diese Pulle Bier ""teurer als bisher"". Wenn die Pulle Bier so teuer wie ein Wocheneinkauf ist, dann haben Sie eine Vorstellung davon, über welche Summen wir hier reden. Bedenken Sie, dass es IMMER teurer wird, als man dem Wähler vorgaukelt. Ich zum Beispiel werde der Erste sein, der da an die Tür klopfen wird, um mir das Geld anderer Leute abzuholen. Und für den Rest arbeite ich schwarz – so wie Millionen anderer es auch machen werden. Mit Speck fängt man Mäuse. Mit ""Garantiesicherung"" Idioten.",1,1,0
576,330,"Sorry aber das ist wirklich jammern auf hohem Niveau. Es gibt einige Millionen Menschen im Land die sind als deutsche geboren und werden, sobald sie sich outen bzw eine Meinung vertreten die einem Deutschen der alten Bundesländer missfällt als Ossi, dunkeldeutscher und somit als dumm, rückwärts gerichtet etc verunglimpft. Aber die sind nicht im Dauerheul - Modus. Die Opferrolle bringt einen heute weiter, deshalb bedient man sich ihrer. Bestes Beispiel Jussie Smollett",0,1,0
577,2806,@USER So wie ihrer hier??,0,0,0
578,2796,@USER Demokratie,0,0,0
579,2500,Sollten die Grünen mal regieren kommt es zur Katastrophe.,1,0,0
580,3046,Weil Sie das Thema derailen wollen. Nur ist das Sendungsthema kein Wunschkonzert für Anhänger*innen der völkisch-nationalistischen AfD.,1,0,0
581,1570,"warum nur machen alle so eine betroffenheitsfratze, das regt doch sofort zum umschalten an. kann man nicht ein paar freundliche beispiele bringen, um nicht das gefühl zu haben, dass wir morgen alle sterben müssen. wer versorgt denn dann die neulinge hier? hmm - für mich ist der HR ein viel positiverer Sender als der WDR, wo jeden abend auch im vorabendprogramm rumgefeeeenst wird.",1,0,0
582,1979,@USER und viele wissen nicht dass bei dem Spender der Blutdruck steigt und manche stark schwitzen was bei einer normalen OP auf starke Schmerzen hinweist.....und warum werden sie angeschnallt!? ...... sie sind doch tot......,0,0,1
583,1450,"was nicht passt wird passend gemacht AKWs Verlängerung,..",0,0,0
584,596,@USER Da Aus Düsseldorf war der liebe Jung.,0,0,1
585,1425,@USER sind sie der Meinung dass das winzige Deutschland ihn aufhalten kann ? 😂😂,1,0,0
586,1978,@USER Blödsinn,0,0,0
587,3118,@USER und die Fortsetzung findet hier mit den meisten Beiträgen statt.,0,0,0
588,2841,"Die AfD hat mit ihren Beschimpfungen, Lügen und ihren Fremdenhass mindestens zur Verrohung der Diskussionskultur beigetragen. Und wie schnell auf Worte, Taten folgen, hat man an diesem Attentat gesehen. Selbstverständlich trägt die AfD und ihre Unterstützer eine Mitschuld.",0,0,1
589,2151,"Kennen sie eigentlich die Gruppe ""Juden in der AfD""?",0,0,0
590,1468,"@USER Ja ist doch so, jeder lebt nur ein mal und wenn es möglich ist wird es doch gemacht. Kenne Nachbarn die fahren ( fliegen) 4-5 mal in den Urlaub ,im Jahr, die verzichten auf nichts.",0,0,0
591,632,@USER willst du mich besuchen?,0,0,0
592,147,""" Hauptsache, sie haben ganz konkret erfahrbar ""edel"" Leben gerettet und können sich in diesem Gefühl suhlen. "" Die AfD und Co. suhlt sich statt dessen in den Leichen der Menschen, die auf der Flucht ums leben bekommen sind.",1,0,0
593,2315,"Peter Filzmaier gefällt uns sehr gut, er hakt ein, wenn Plasberg leider noch zuhört... //Team Boris Palmer Watch",0,1,0
594,513,"@USER Hat sich ziemlich Zeit gelassen, Dein Kragenplatzen. Ich habe mit rückständigen Menschen nichts am Hute, und am wenigsten interessiert mich deren Nationalität, stehe ich vor einem A-loch, frage ich nicht nach seinem Pass, spielt keine Rolle. Und ich bin Anfang der siebziger Jahre in Hannover geboren worden, ich komme aus dem Uterus meiner Mutter, DAS ist meine Herkunft, und niemand schreibt mir vor, ob ich Deutschland als meine Heimat betrachten darf oder nicht. Schöne Grüße.",0,1,1
595,2013,"@USER, von der Wir-sind-mehr-Sekte habe ich auch nichts anderes erwartet.",1,0,0
596,2614,Das Publikum klatscht für jeden scheiss sind wohl gekauft,1,0,0
597,1479,Eine Autodebatte es wäre eine KI und Bildungsdebatte wichtiger..,0,0,0
598,1456,was ICH? was hab ich geschrieben... das einzig beleidigende höre ich der alte weiße Mann und die Politiker haben nichts getan das kommt in der Runde..,0,0,0
599,2000,Das Unterhaus ist eine klasse Clownstruppe...könnten auf Tournee gehen 🤡 😁,1,0,0
600,3073,@USER auch hier hatespeech vom Feinsten!!,0,0,0
601,2639,Die Grünen helfen ihren Flüchtlingen dann im Mittelmeer mit Ihrem Fahrad 😂😂😂😂😂,1,0,0
602,358,Bohlen ist nun 66 Jahre der hört schon schlecht und sieht schlecht...,0,0,1
603,570,"@USER Eugenik ist, Nationalität an der Genetik festzumachen und Deine Mutter ist gescheitert.",1,0,1
604,1445,wird in Österreich gefördert aber noch zu teuer die deutschen oder Europäer es müssten 20000 Euro Einstiegsmodelle sein.,0,0,1
605,67,"@USER habe letztens erst gehört, dass einige Geschäfte Nichte mehr an die Tafeln abgeben dürfen es sei denn, die bezahlen das Gesundheitsamt dafür das die Lebensmittel welche an die Tafeln gehen würden von denen überprüfen lassen. Der Gesetzgeber hat damit Dünndärmen Menschen erneut die Möglichkeit genommen etwas für wenig Geld zu bekommen. Ich befürchte, dass einige Geschäfte ihre nich haltbaren Lebensmittel lieber in die Tonne kloppen statt dafür zu bezahlen das die Tafeln und somit die arme Bevölkerung etwas davon haben. Ich sage nur armes Deutschland",0,1,1
606,1075,"@USER, das muss ich nicht in einer Internetsuchmaschine suchen, darüber habe ich so 1985/1986 ein Referat in der Schule geschrieben und gehalten. Sorry.",0,1,0
607,2969,...und da haben wir es wieder! 😂😂😂 Phobie... Mimimimi...,0,0,0
608,1573,@USER ...in der Tat 👍,0,0,0
609,839,"Werter Hr. Karl Gruwerich, das geschieht dann automatisch, weil die Ursache der Landflucht unter anderem auch an der fehlenden Infrastruktur auf dem Land liegt. Z.B. sind die Bodenwerte auf dem Land geringer als in der Stadt. Wenn also jetzt der ""Boden"" anders besteuert wird, dann würde in der Konsquenz auch die Landflucht rückläufig sein – weil wirtschaftlich denkende Menschen sowie Unternehmen – dann genau überlegen würden – ob eine Investition in der Stadt oder in d. Peripherie Sinn macht. Denn in der Praxis sieht es momentan so aus, dass die Grund und Boden- Eigentümmer in der Stadt die Erträge privatisieren, jedoch Kosten (Infrastruktur, Netze, öffentliche Gebäude etc.) durch die ungerechte Besteuerung in Deutschland sozialisieren. Deshalb Hr. Gruwerich, noch mehr die Ursachen der Wohnraumproblematik behandeln – wie durch die bessere sowie faire Besteuerung mit der ""Singletax"" geht gar nicht mehr.",0,1,1
